{
  "schemaVersion": "1.1",
  "chapterId": "C01",
  "contentVersion": 1,
  "publicationStatus": "draft_pending_human_review",
  "variants": [
    {
      "id": "C01-L01-A1",
      "lessonId": "C01-L01",
      "contentVersion": 1,
      "practiceLevel": "A1",
      "titleFr": "Dis qui tu es",
      "objectiveFr": "Donne un prénom compréhensible. Communique un âge réel ou fictif en anglais. Communique une ville où tu habites, réelle ou fictive.",
      "coachRole": "Une nouvelle connaissance bienveillante",
      "userRole": "Une personne qui peut utiliser sa propre situation ou un personnage fictif ; le contexte est adapté à son objectif.",
      "openingEn": "Hi! What's your name?",
      "followUpsEn": [
        "How old are you?",
        "Can you tell me your name and your city together?"
      ],
      "difficultyFollowUpEn": "Can you tell me your name and your city together?",
      "easierVariantHintFr": "On peut reprendre une information à la fois, avec un exemple et une réponse écrite si tu préfères.",
      "requiredCriteria": [
        {
          "id": "identity_name",
          "descriptionFr": "Donne un prénom compréhensible.",
          "exampleEn": "My name is Alex."
        },
        {
          "id": "identity_age",
          "descriptionFr": "Communique un âge réel ou fictif en anglais.",
          "exampleEn": "I am thirty years old."
        },
        {
          "id": "identity_city",
          "descriptionFr": "Communique une ville où tu habites, réelle ou fictive.",
          "exampleEn": "I live in Lyon."
        }
      ],
      "miniLesson": {
        "explanationFr": "Pour donner ton âge, utilise I am, pas I have. Tu peux utiliser une identité inventée. Une information à la fois suffit.",
        "examplesEn": [
          "I'm thirty years old.",
          "I live in Lyon."
        ],
        "optional": true
      },
      "supports": [
        "translate",
        "sentence_starter",
        "listen_model",
        "text_mode"
      ],
      "microExercise": {
        "promptFr": "Présente-toi à Sam avec ton prénom et ta ville, sans recopier une phrase complète. Garde tes vraies informations ou invente-les.",
        "expectedSemanticCriteria": [
          "Le prénom et la ville sont compréhensibles.",
          "Les informations sont choisies par l’utilisateur ; une structure simple identique au modèle est acceptable."
        ],
        "sampleAnswerEn": "I'm Alex. I live in Paris.",
        "alternativePromptFr": "Présente-toi à un nouveau voisin avec ton prénom et ta ville. Tu peux utiliser une identité fictive."
      },
      "targetMinutes": 3,
      "maxUsefulTurns": 6,
      "fallbackFeedbackFr": "Je n’ai pas assez d’éléments fiables pour confirmer tous les objectifs. Ta progression est conservée ; reprenons seulement le point restant."
    },
    {
      "id": "C01-L01-A2",
      "lessonId": "C01-L01",
      "contentVersion": 1,
      "practiceLevel": "A2",
      "titleFr": "Présente-toi et fais connaissance",
      "objectiveFr": "Présente ton prénom et ton activité. Ajoute un intérêt personnel compréhensible. Pose une question simple à ton interlocuteur.",
      "coachRole": "Une nouvelle connaissance bienveillante",
      "userRole": "Une personne qui peut utiliser sa propre situation ou un personnage fictif ; le contexte est adapté à son objectif.",
      "openingEn": "Hi, I'm Sam. What do you do?",
      "followUpsEn": [
        "What do you enjoy doing in your free time?",
        "What would you like to know about me?"
      ],
      "difficultyFollowUpEn": "What would you like to know about me?",
      "easierVariantHintFr": "On peut refaire cette leçon avec des questions plus courtes et davantage d’aide. Tu peux aussi choisir une version plus accessible pour une nouvelle tentative.",
      "requiredCriteria": [
        {
          "id": "intro_activity",
          "descriptionFr": "Présente ton prénom et ton activité.",
          "exampleEn": "I am Alex. I am a student."
        },
        {
          "id": "intro_interest",
          "descriptionFr": "Ajoute un intérêt personnel compréhensible.",
          "exampleEn": "I enjoy cooking."
        },
        {
          "id": "intro_return_question",
          "descriptionFr": "Pose une question simple à ton interlocuteur.",
          "exampleEn": "What do you like doing?"
        }
      ],
      "miniLesson": {
        "explanationFr": "Ajoute une activité et un intérêt à ta présentation. Pour continuer l’échange, pose une question simple à l’autre.",
        "examplesEn": [
          "I'm a student and I enjoy cooking.",
          "What do you like doing?"
        ],
        "optional": true
      },
      "supports": [
        "translate",
        "sentence_starter",
        "listen_model",
        "text_mode"
      ],
      "microExercise": {
        "promptFr": "Tu rencontres une autre personne. Présente ton activité et un intérêt, puis pose-lui une question.",
        "expectedSemanticCriteria": [
          "Activité et intérêt sont exprimés clairement.",
          "Une question pertinente invite l’autre à répondre."
        ],
        "sampleAnswerEn": "I'm a student and I like music. What do you do?",
        "alternativePromptFr": "Tu rejoins un club. Dis ce que tu aimes faire et demande à quelqu’un ce qu’il aime."
      },
      "targetMinutes": 3,
      "maxUsefulTurns": 6,
      "fallbackFeedbackFr": "Je n’ai pas assez d’éléments fiables pour confirmer tous les objectifs. Ta progression est conservée ; reprenons seulement le point restant."
    },
    {
      "id": "C01-L01-B1",
      "lessonId": "C01-L01",
      "contentVersion": 1,
      "practiceLevel": "B1",
      "titleFr": "Présente ton activité et ta motivation",
      "objectiveFr": "Présente ton activité avec un détail pertinent. Explique une motivation en reliant tes idées. Réponds de manière pertinente à une relance non récitée.",
      "coachRole": "Une nouvelle connaissance bienveillante",
      "userRole": "Une personne qui peut utiliser sa propre situation ou un personnage fictif ; le contexte est adapté à son objectif.",
      "openingEn": "Hi! Tell me a little about what you do.",
      "followUpsEn": [
        "Why would you like to practise English?",
        "In which situation would better English help you most?"
      ],
      "difficultyFollowUpEn": "In which situation would better English help you most?",
      "easierVariantHintFr": "On peut refaire cette leçon avec des questions plus courtes et davantage d’aide. Tu peux aussi choisir une version plus accessible pour une nouvelle tentative.",
      "requiredCriteria": [
        {
          "id": "intro_background",
          "descriptionFr": "Présente ton activité avec un détail pertinent.",
          "exampleEn": "I work in IT and help small businesses."
        },
        {
          "id": "intro_motivation",
          "descriptionFr": "Explique une motivation en reliant tes idées.",
          "exampleEn": "I want to improve my English because I work with international clients."
        },
        {
          "id": "intro_followup",
          "descriptionFr": "Réponds de manière pertinente à une relance non récitée.",
          "exampleEn": "Mostly during online meetings."
        }
      ],
      "miniLesson": {
        "explanationFr": "Organise ta présentation autour de ton activité, d’un détail et de ta motivation. Because permet de relier une intention à sa raison.",
        "examplesEn": [
          "I work in IT and help small businesses.",
          "I want to speak more confidently because I meet international clients."
        ],
        "optional": true
      },
      "supports": [
        "translate",
        "sentence_starter",
        "listen_model",
        "text_mode"
      ],
      "microExercise": {
        "promptFr": "Présente-toi à un nouveau partenaire d’apprentissage. Explique en deux ou trois phrases ton activité et une situation où tu veux progresser.",
        "expectedSemanticCriteria": [
          "La présentation contient une activité et une motivation reliées.",
          "Un contexte concret illustre le besoin, sans exiger un nombre exact de phrases."
        ],
        "sampleAnswerEn": "I work in IT. I want to feel more confident when I explain a problem to a client.",
        "alternativePromptFr": "Explique à un ami ton activité et pourquoi tu pratiques l’anglais, avec un exemple de situation utile."
      },
      "targetMinutes": 3,
      "maxUsefulTurns": 6,
      "fallbackFeedbackFr": "Je n’ai pas assez d’éléments fiables pour confirmer tous les objectifs. Ta progression est conservée ; reprenons seulement le point restant."
    },
    {
      "id": "C01-L01-B2",
      "lessonId": "C01-L01",
      "contentVersion": 1,
      "practiceLevel": "B2",
      "titleFr": "Présente-toi à un nouveau collègue",
      "objectiveFr": "Sélectionne deux informations pertinentes pour une rencontre professionnelle. Développe l’une de ces informations avec un exemple concret. Réponds à une relance imprévue sans perdre le fil.",
      "coachRole": "Une nouvelle connaissance bienveillante",
      "userRole": "Une personne qui peut utiliser sa propre situation ou un personnage fictif ; le contexte est adapté à son objectif.",
      "openingEn": "We've just joined the same project. Could you tell me a little about your background?",
      "followUpsEn": [
        "Could you give me an example of a project you enjoyed?",
        "What would you bring to a team with a different way of working?"
      ],
      "difficultyFollowUpEn": "What would you bring to a team with a different way of working?",
      "easierVariantHintFr": "On peut refaire cette leçon avec des questions plus courtes et davantage d’aide. Tu peux aussi choisir une version plus accessible pour une nouvelle tentative.",
      "requiredCriteria": [
        {
          "id": "intro_context_selection",